{
  "event_id": "00000000-0000-4000-8000-000000000002",
  "event_type": "inventory.receipt.posted",
  "aggregate_type": "stockmovement",
  "aggregate_id": "10000000-0000-4000-8000-000000000002",
  "aggregate_version": 1,
  "schema_version": 1,
  "occurred_at": "2026-09-27T12:00:00.000000+00:00",
  "trace_context": {
    "traceparent": "00-4bf92f3577b34da6a3ce929d0e0e4736-00f067aa0ba902b7-01"
  },
  "payload": {
    "movement_id": "10000000-0000-4000-8000-000000000002",
    "movement_type": "RECEIPT",
    "title": "Receipt posted",
    "body": "MOV-2",
    "recipients": [
      "20000000-0000-4000-8000-000000000001"
    ],
    "lines": [
      {
        "batch_id": "30000000-0000-4000-8000-000000000001",
        "warehouse_id": "40000000-0000-4000-8000-000000000001",
        "delta_qty": "1.000001",
        "unit_cost": "0.000003"
      }
    ],
    "_trace_context": {
      "traceparent": "00-4bf92f3577b34da6a3ce929d0e0e4736-00f067aa0ba902b7-01"
    }
  }
}
